ID,Timestamp,Content
1223816001160208384,2020-02-02 03:50:46,RT @NicholsUprising: Epic crowd tonight in Cedar Rapids for @BernieSanders and @vampireweekend. https://t.co/dbH7NPsM7P
1223770246122823680,2020-02-02 00:48:57,"RT @SchwartzForIowa: This is what our movement looks like,  an amazing canvass launch with @ninaturner @CornelWest and @SusanSarandon in Wa…"
1223764528434831360,2020-02-02 00:26:14,There are only two days until the Iowa Caucus! If we keep up the hard work we can win this together. Join us live i… https://t.co/ZDsG0nyDqU
1223748073974902785,2020-02-01 23:20:51,I’m honored to have the support of @unitehere23's Texas Chapter. Unions like @UNITEHERE are the last line of defens… https://t.co/l9xwabPSWU
1223723237248577538,2020-02-01 21:42:10,RT @ninaturner: Living while Black in America has always been a political act. I do what I do in honor of our ancestors who moved mountains…
1223720211347640322,2020-02-01 21:30:08,"The sit-in at Woolworth’s in Greensboro on Feb. 1, 1960 began a sit-in movement of 70,000 participants and some 3,0… https://t.co/t0yWDuvdNP"
1223704065047220234,2020-02-01 20:25:59,This is the richest country in the history of the world. We can afford to guarantee health care and education for a… https://t.co/vuEB6CPRMs
1223689024365264896,2020-02-01 19:26:13,"RT @sunrisemvmt: Our strategy for 2020 isn't just about electing @BernieSanders.

It's about building a movement of young people in every c…"
1223683460860194817,2020-02-01 19:04:06,The future of the planet is at stake. The only way we will solve this crisis is by building a mass movement of peop… https://t.co/FXw3AyiK0z
1223674807046365184,2020-02-01 18:29:43,RT @briebriejoy: “The problems that we have did not come down from the heavens. They are made by human decisions. And good human decisions…
1223673135280599041,2020-02-01 18:23:04,RT @People4Bernie: Tweet to #NotMeUs on how you've helped build the political revolution.
1223672946453028865,2020-02-01 18:22:19,RT @samoriginals: #NotMeUs https://t.co/GZDKI0IQgb
1223672867742720001,2020-02-01 18:22:01,"RT @the_vello: A better world is possible and it’s up to us to make it happen.

Let’s do this together. 

All of us.

#NotMeUs 

 https://t…"
1223672697625948161,2020-02-01 18:21:20,RT @emily_isaac_: I’m so moved by the thousands of volunteers on the ground in Iowa talking to voters about how we can build a country that…
1223672583050223616,2020-02-01 18:20:53,"RT @StephCW_: This movement is about ensuring that those at the top are working for the many, not the money. It’s about fighting for someon…"
1223672168942272518,2020-02-01 18:19:14,RT @BeccaRast: I've been organizing for 14 years. I started as a 16 year old looking for a way to express my rage about the war in Iraq.…
1223671327581708289,2020-02-01 18:15:53,RT @ariannaijones: despair is not an option. our job is to give people hope. #NotMeUs
1223670210185420800,2020-02-01 18:11:27,We are two days from the Iowa caucus and now is the time to get involved and help us win. Today I’m at Simpson Coll… https://t.co/UhmbA8jXU4
1223667657016250368,2020-02-01 18:01:18,"No president, no matter how well-intentioned, can transform this country alone. I need you to be a part of this mov… https://t.co/M8jalHf7Pu"
1223651987759255558,2020-02-01 16:59:02,"Our job is to give people hope. If we stand together, there is nothing that we cannot accomplish. https://t.co/ELVAypiJM4"
1223459148370714625,2020-02-01 04:12:46,"$10 may not seem like the kind of money that can win an election, but someone just gave that amount to our campaign… https://t.co/PlFvk9XMq9"
1223409072755494912,2020-02-01 00:53:47,"Together, we can win this election and transform the country. Watch our first Caucus Concert featuring @boniver, li… https://t.co/GViMf906gd"
1223407677553938433,2020-02-01 00:48:14,"For my entire career I have fought to protect and expand Social Security. After we defeat Donald Trump, together, t… https://t.co/srRYEeQqIy"
1223390310430117888,2020-01-31 23:39:14,RT @janeosanders: Great talking small business with such an incredible crowd of community leaders and small business owners. Having a wonde…
1223378363886252032,2020-01-31 22:51:45,Today is a sad day for democracy. https://t.co/A7ApOib249
1223375245421268995,2020-01-31 22:39:22,"Thank you @LUCHA_AZ for your endorsement! You know what I know: to transform this country and bring about economic,… https://t.co/3BH3sVBdNo"
1223372998025064448,2020-01-31 22:30:26,"RT @zerohourmvmt: 🚨 BREAKING NEWS 🚨 

THE ZERO HOUR MOVEMENT OFFICIALLY ENDORSES BERNIE SANDERS FOR PRESIDENT OF THE UNITED STATES!

#ZeroH…"
1223372478397009929,2020-01-31 22:28:22,"RT @Jamie_Margolin: 🚨BREAKING NEWS 🚨

The Zero Hour Movement (@zerohourmvmt) is officially endorsing @BernieSanders for president!

#ZeroHo…"
1223366291236454400,2020-01-31 22:03:47,I'm honored to be endorsed by @zerohourmvmt. The young people of this country have incredible power when they speak… https://t.co/4IcmmTpeSr
1223365255725768705,2020-01-31 21:59:40,"RT @yovimi: Why is the @BernieSanders #disability plan so good? Let's go over some of the highlights. Because trust me, I'd be a lot less o…"
1223362594611830784,2020-01-31 21:49:06,It is outrageous that Donald Trump continues to push a racist travel policy that dehumanizes immigrants and their f… https://t.co/A3WuoRbq9U
1223360740767088640,2020-01-31 21:41:44,"The Iowa caucus is just three days away and now, more than ever, is the time to get involved and stand against Trum… https://t.co/BnUrZ4jfg4"
1223357180264488960,2020-01-31 21:27:35,"If you've been waiting for the right time to contribute to our campaign, now is the time. Our final FEC fundraising… https://t.co/Zqga7VwgOH"
1223342032413962240,2020-01-31 20:27:23,"“If I had Medicare for All in 2012, I’d still be working. I wouldn’t be sitting here dying in my own home. And I do… https://t.co/9sYdBtDWEj"
1223335970424213504,2020-01-31 20:03:18,RT @aneeman: I'm proud to have worked with a fantastic group of activists to help develop @BernieSanders's disability policy plan. (1) #Cri…
1223333459105583105,2020-01-31 19:53:19,Congratulations to the members of @TransportWorker union and @MachinistsUnion for this great victory. In our admini… https://t.co/DkMU3QZRyM
1223310685645438976,2020-01-31 18:22:50,"From the start of this campaign, we knew we would be taking on the entire political establishment, the corporate me… https://t.co/d8wzWceZxL"
1223303851828305920,2020-01-31 17:55:40,Have you ever received an unexpected medical bill?
1223284115866296323,2020-01-31 16:37:15,We cannot keep a system that forces people with disabilities into nursing homes and institutions to pad the profits… https://t.co/q5GREShZDs
1223273808368369666,2020-01-31 15:56:17,"RT @PramilaJayapal: Getting my morning started here in #Iowa with some great volunteers in Council Bluffs! 

We’re ALL in for @BernieSander…"
1223258643459723264,2020-01-31 14:56:02,"Together, we will protect and expand Social Security Disability Insurance and SSI by reversing Trump’s attack on th… https://t.co/gn87kt1fYr"
1223233420995760128,2020-01-31 13:15:48,Every person with a disability deserves the right to live in their community and have the support they need to thri… https://t.co/xY5sFC5UVQ
1223052708401291264,2020-01-31 01:17:43,"RT @PramilaJayapal: I’m proud to be a woman of color, immigrant, activist &amp; progressive member of Congress—&amp; I’m proud to be all in for @Be…"
1223045781562650625,2020-01-31 00:50:12,"Hace cuatro años, la gente de Iowa inició nuestra revolución política. Con su ayuda el 3 de feb., podemos comenzar… https://t.co/b08Je4TkAS"
1223042264362078208,2020-01-31 00:36:13,"“Nothing can be done just as one. It has to be done as the movement. And that’s the organizer in Bernie, inside and… https://t.co/d85X5PHEiv"
1223009452871364609,2020-01-30 22:25:50,"I am proud to stand with @MindiMessmer4NH in her campaign for New Hampshire's Executive Council. Together, we will… https://t.co/Kq5W3BMxpC"
1222998917312385032,2020-01-30 21:43:58,I stand in solidarity with the @HuffPostUnion/@WGAEast. All workers deserve a fair contract with good pay and benef… https://t.co/AMgoKspWHW
1222972950497894401,2020-01-30 20:00:47,"Home health care workers are doing some of the most important work in this country. They deserve respect, decent wa… https://t.co/TUMZUTAdLt"
1222961513079681025,2020-01-30 19:15:20,"We need candidates who champion the people and the issues at every level, in every state. I'm proud to endorse… https://t.co/K7eF4wUYKl"
1222954405902766080,2020-01-30 18:47:06,In just four days the people of Iowa will take the first stand against the divisiveness and bigotry of Donald Trump… https://t.co/z0sAXWSiRd
1222945099694264322,2020-01-30 18:10:07,In just four days the people of Iowa will take the first stand against the divisiveness and bigotry of Donald Trump… https://t.co/geveACzqOq
1222923741371473921,2020-01-30 16:45:15,"I’m so honored to receive the endorsement of the @APWUnational. When we defeat Donald Trump, we're not going to pri… https://t.co/oL6jtdBKfC"
1222917572951269376,2020-01-30 16:20:44,Donald Trump wants to cut Social Security. We're not going to let that happen. We are going to protect and EXPAND S… https://t.co/4fmf8VLYbz
1222721140046647296,2020-01-30 03:20:11,I’m honored to have the support of @UFCW21. Together we’re going to build a movement to create a political revoluti… https://t.co/jseRKqRxDp
1222705681460948993,2020-01-30 02:18:45,"Together we are going to bring out the largest voter turnout in history, defeat Trump, and transform this country.… https://t.co/3cx5VIWcGM"
1222698589643780098,2020-01-30 01:50:35,"When workers organize to fight for fair wages and dignity, we all win. Congratulations to the members of… https://t.co/eUqID3IgDU"
1222684760713179136,2020-01-30 00:55:37,"Trump has been attacking our campaign because he's getting nervous.

Poll after poll shows that we are the stronges… https://t.co/4Jf9rAcNyq"
1222677862362374145,2020-01-30 00:28:13,"Today I'm proud to endorse @SDGeorgette, who will continue to be a strong advocate for real change as a member of C… https://t.co/RDZdzw1de6"
1222663053378048001,2020-01-29 23:29:22,I stand with @UNITEHERE_SoFla and call on @AmericanAir to give these workers the compensation and benefits that the… https://t.co/uqTnT188GK
1222633255364702210,2020-01-29 21:30:58,The big money interests can run all the negative ads they want. It's not going to work. Our grassroots movement is… https://t.co/FUX0S0yQ3I
1222627447981690880,2020-01-29 21:07:53,"Tonight: join @janeosanders, @NaomiAKlein, @kendrick38, and @lascafeteras for a rally in Iowa City! RSVP here and f… https://t.co/glmuJ6U2JN"
1222620819223994371,2020-01-29 20:41:33,"If young people come out and vote in high numbers, we can fundamentally transform this country."
1222620300673679362,2020-01-29 20:39:29,"RT @JCisnerosTX: I'm so grateful to receive the endorsement of @BernieSanders, who's running a grassroots campaign to fight for working peo…"
1222606082973061123,2020-01-29 19:42:59,On day one of my administration we will repeal all of Trump’s racist immigration orders.
1222589065624723462,2020-01-29 18:35:22,"Real change comes from the bottom on up, not the top on down. I'm proud to endorse @JCisnerosTX for Congress. Toget… https://t.co/PwQWrW9RPi"
1222570126375096323,2020-01-29 17:20:07,"I am proud to be endorsed by @WDActionFund. Together, we will fight for working people across this country and buil… https://t.co/BJfQWuTgVE"
1222569174926577664,2020-01-29 17:16:20,RT @SusanSarandon: So unbelievably consistent. https://t.co/wrVsMIvcJp
1222569106106470400,2020-01-29 17:16:03,RT @ariannaijones: it takes courage to stay the course. https://t.co/lniOUBUgJi
1222569004897918978,2020-01-29 17:15:39,"RT @fshakir: Steady, consistent convictions that you can trust when he's in the Oval Office https://t.co/dl7Vl16UQq"
1222565612213407748,2020-01-29 17:02:10,Trump’s trade deal is a giveaway to the fossil fuel industry and a disaster for the climate. As the only leading De… https://t.co/d9nlt71Bho
1222556676571701248,2020-01-29 16:26:40,"RT @robdelaney: Please watch. I love the “Not me, us” slogan but I do so sincerely hope this guy is our next president. https://t.co/Fy4AZC…"
1222552369390637057,2020-01-29 16:09:33,I will never stop fighting for the working people of this country. https://t.co/1V91xa638J
1222542802522976262,2020-01-29 15:31:32,RT @NaomiAKlein: Today! https://t.co/acrdIPADw9
1222542674290450433,2020-01-29 15:31:01,"Averting the climate crisis and creating 20 million jobs.

Ending all forms of environmental racism.

Building a go… https://t.co/KLadw0x8uP"
1222532957900017664,2020-01-29 14:52:25,"New Hampshire: join our Get Out the Vote Concert Rally with @thestrokes on February 10th! Together, we can win this… https://t.co/srLCLk5PgO"
1222531669418180608,2020-01-29 14:47:18,"RT @thestrokes: #berniebeatstrump

https://t.co/bhmHGxZJVv https://t.co/RccTvHIYep"
1222522112612671488,2020-01-29 14:09:19,RT @ZephyrTeachout: Oh my god I love this ad. This is what the billionaires and corporate interests are scared of. Compassion. Fairness. De…
1222351836906213381,2020-01-29 02:52:42,RT @RashidaTlaib: The #peoplepower movement will win because we are speaking truth and have the moral clarity needed to push back against t…
1222351668056068096,2020-01-29 02:52:02,"RT @johncusack: “@BernieSanders: It's no secret that we're taking on the political establishment and the big money interests, who are now r…"
1222348033347719172,2020-01-29 02:37:35,"Tomorrow: join @janeosanders, @NaomiAKlein, @kendrick38, and @lascafeteras for a rally in Iowa City! RSVP here and… https://t.co/uKMDBU2iha"
1222340490818920449,2020-01-29 02:07:37,"RT @PramilaJayapal: I stand w/the 8,000 @SEIU1199NW health care workers striking for safe staffing &amp; patient safety at Swedish.

I encourag…"
1222317263283478529,2020-01-29 00:35:19,RT @fshakir: Bring it! https://t.co/TQbrcjF4Ey
1222314390478868480,2020-01-29 00:23:54,"It's no secret that we're taking on the political establishment and the big money interests, who are now running at… https://t.co/1SfpRSGCdy"
1222304216917647360,2020-01-28 23:43:29,"Medicare for All means freedom to choose your doctor and your hospital — not getting outrageous ""out of network"" bi… https://t.co/q738UoOqtm"
1222289056165482497,2020-01-28 22:43:14,"Joe Biden said not a single scientist supported my climate plan. Well, Joe, you’re wrong. Scientists agree: we need… https://t.co/OFXZYKHquD"
1222272957034254337,2020-01-28 21:39:16,"I am honored to receive the endorsement of @UNITEHERE11, one of the fastest-growing local unions in the nation — wh… https://t.co/hzdqVrLyld"
1222263768970747904,2020-01-28 21:02:45,We are Big Pharma's worst nightmare.
1222247691712897026,2020-01-28 19:58:52,"We are in a housing crisis, and the impact is disproportionately felt by low-wage workers, especially women. We nee… https://t.co/LdZfK3kK56"
1222232686015717381,2020-01-28 18:59:14,"In 2017, 10,000 people died waiting for Social Security Disability Insurance.

Instead of addressing this crisis, T… https://t.co/sRIskCo6o7"
1222209336744738819,2020-01-28 17:26:28,"RT @janeosanders: Excellent weekend in Las Vegas; meeting with @SEIU1107
members, @BattleBornProg organizers, Western Shoshone tribal leade…"
1222197889063100418,2020-01-28 16:40:58,"This campaign is not just about me. It's about us.

Together, we are going to win Iowa, defeat Trump and transform… https://t.co/FaGwwsltQX"
1222171326875676672,2020-01-28 14:55:25,"I have a message for the top 1% and the large profitable corporations in this country:

Enjoy the massive tax break… https://t.co/FeHVaeh5Gt"
1221968255184703489,2020-01-28 01:28:29,“We should not be scared of what will happen if we try. We should be scared of what will happen if we don’t.” –@AOC https://t.co/NZLmwyoRSF
1221958117321269248,2020-01-28 00:48:12,RT @PramilaJayapal: It’s time to pass #MedicareForAll.
1221934077466509312,2020-01-27 23:12:41,My first executive orders will be to reverse every single thing President Trump has done to demonize and harm immig… https://t.co/wWUc413ZzB
1221915627440480256,2020-01-27 21:59:22,"Parents must be able to get childcare without struggling to pay rent or buy food.

Children must have the best poss… https://t.co/QiYMqNye2p"
1221885398357610499,2020-01-27 19:59:15,I'm proud to stand with the brave janitors of @SEIULocal1 and their allies who are risking arrest today in St. Loui… https://t.co/j518PiIOPN
1221880672245166081,2020-01-27 19:40:28,"There is nothing more important than building a movement to reject hate, fear, and division.

This is how we honor… https://t.co/nmKawIwZB5"
1221880670915526659,2020-01-27 19:40:28,"On this day 75 years ago, Allied forces liberated the Auschwitz-Birkenau death camp, the scene of the most horrific… https://t.co/lMoUtR2L9S"
1221872540177567744,2020-01-27 19:08:09,"My father came to America at 17 without a nickel, speaking no English. He grew up to be the proudest American you e… https://t.co/K6aSORf80W"
1221848880003850240,2020-01-27 17:34:08,The future of this planet is more important than the profits of the fossil fuel industry.
1221825421399994368,2020-01-27 16:00:55,"For 100 years, presidents have talked about the need to guarantee health care for all.

Now is the time.

We must m… https://t.co/oaAI7LcWES"
1221822654048620544,2020-01-27 15:49:55,"Our campaign is about doing something different. It's about lifting up the voices, struggles and power of working p… https://t.co/YFsIwkvEOT"
1221809743792168960,2020-01-27 14:58:37,"Seniors cannot live in dignity when they're trying to survive on $13,000 or $14,000 a year in Social Security benef… https://t.co/u6CkJPKmN9"
1221607376274354177,2020-01-27 01:34:29,Demagogues like Trump try to divide us up. Our movement is about coming together to create a nation where every per… https://t.co/guBMsZ6TYe
1221556101805592578,2020-01-26 22:10:44,"A nation’s greatness is judged not by how many billionaires it has, but how it treats the people most in need. That… https://t.co/CHPANIQ1ea"
1221488580922445824,2020-01-26 17:42:26,"We are so close to the Iowa caucuses and I need your help to ensure we are successful. Join me, @AOC and @MMFlint l… https://t.co/ZjQzxfRk2b"
1221487059896098816,2020-01-26 17:36:23,Polls are one thing. Getting out the vote is something else. We need all the help we can get to make sure our movem… https://t.co/AZn3WCjeT0
1221471669568573442,2020-01-26 16:35:14,Here's the truth: the billionaire class is fine with corporate socialism when it means they get billions in tax bre… https://t.co/FxRM5Lu4LA
1221471505885945856,2020-01-26 16:34:35,"RT @ChicagoMaroon: EDITORIAL: ""@BernieSanders's vision of the presidency as 'organizer-in-chief' sets him apart from other candidates. It a…"
1221285580388151296,2020-01-26 04:15:47,“I support Bernie Sanders because I believe he will lead from a moral center borne of a lifelong commitment to serv… https://t.co/zvU5zPhrSo
1221278766648954881,2020-01-26 03:48:42,"If you want to vote for Bernie in the California Democratic primary and registered No Party Preference (NPP), you M… https://t.co/TGjgx9hOvE"
1221258633729781760,2020-01-26 02:28:42,RT @AriRabinHavt: Rally in Ames completely full and so is a second gym we are using as overflow space. @BernieSanders went to speak to them…
1221243209835089921,2020-01-26 01:27:25,"I cannot win this election alone. Together, we will build the movement to win and create a nation based on justice… https://t.co/4wYdGi84WJ"
1221212487095242753,2020-01-25 23:25:20,Every day the media and political establishment tell you: think small. Our campaign understands that if we stand to… https://t.co/tpVZYUTH5E
1221199710901370880,2020-01-25 22:34:34,This is the richest country on Earth and teachers shouldn’t have to work two or three jobs to put food on the table… https://t.co/HRJXIX45xO
1221185462993330183,2020-01-25 21:37:57,RT @BNeidhardt: UPDATE: @BernieSanders is joining @AOC &amp; @MMFlint at tonight's rallly in Marshalltown https://t.co/NQIBxlcVeJ
1221183647438512128,2020-01-25 21:30:44,"It's nine days until the Iowa caucuses, and it looks like our opponents are pretty nervous that we're going to win.… https://t.co/V3qYlZhZuz"
1221177914328219649,2020-01-25 21:07:57,No one should have to watch a loved one die because they don't have health insurance. I don't understand what is so radical about that.
1221146737278160897,2020-01-25 19:04:04,"If elected, I promise to be the most pro-union president in American history."
1221133625573412865,2020-01-25 18:11:58,"Our immigration system must live up to our ideals as a nation. Unlike Trump, we will welcome refugees and those see… https://t.co/bXNEth4pP4"
1221114211302019073,2020-01-25 16:54:49,RT @cascamike: every day on our campaign something happens that makes all of us incredibly grateful to play a small part in building the po…
1221111132649349120,2020-01-25 16:42:35,"RT @ninaturner: Millions are struggling to provide a roof for their family. This is a national crisis. @BernieSanders has a plan👇🏾

🏘Build…"
1221110964394897409,2020-01-25 16:41:55,We’ve got a long way to go. It’s going to be a tough fight and we can't take anything for granted. Knock on doors.… https://t.co/e05h9Z7GjO
1221110721997606912,2020-01-25 16:40:57,RT @AbshirDSM: Iowa co-chair @swalker06 &amp; national surrogate @iPhilSomething speaking with student leaders at the University of Iowa Afro H…
1221095281774731264,2020-01-25 15:39:36,"Nothing scares corporate America more than a powerful trade union movement.

I have stood with unions my whole life… https://t.co/T515IZXur9"
1221076517746290689,2020-01-25 14:25:02,"I don't think massive corporations like Amazon, Delta, Eli Lilly, FedEx, JetBlue and Netflix should continue to get… https://t.co/9zpytbaftN"
1220925982846177281,2020-01-25 04:26:52,"Happy Lunar New Year to all those who are celebrating. We wish you and your loved ones peace, joy and good health."
1220922205640544258,2020-01-25 04:11:52,RT @swalker06: My bro out here tearing it up! 🔥🔥🔥 #iacaucus https://t.co/BhrSAfqtEu
1220921353639006209,2020-01-25 04:08:28,RT @Dreamdefenders: 😭 we love you @iPhilSomething! https://t.co/f28UQeuxZx
1220919122311155712,2020-01-25 03:59:36,"RT @BernieSanders: Our slogan “Not Me, Us” has very much become reality since I’ve been in D.C. for Trump’s impeachment trial. You all are…"
1220914081688887296,2020-01-25 03:39:35,RT @iPhilSomething: brought senator @ninaturner with us. #withtheseHANDS! https://t.co/Gv2MCKbgyi
1220909413743104001,2020-01-25 03:21:02,RT @mistyrebik: @iPhilSomething gives me life. And it's movement makers and artists and organizers and truth-tellers that are going win thi…
1220908634164670464,2020-01-25 03:17:56,"RT @IronStache: Brother @iPhilSomething just being real. 
Part of the move in the MOVEment!
#Bernie2020 https://t.co/cRN3B1SO2p"
1220908474953097217,2020-01-25 03:17:18,"RT @joshfoxfilm: This made smile ear to ear. 

Then cry my eyes out. 

Watch this.

The political revolution is on. 

It’s about love and h…"
1220903594205024256,2020-01-25 02:57:54,I can't be in Iowa tonight. But @iPhilSomething just showed Iowa City the power of fighting for someone you don't k… https://t.co/K43kpCoBO9
1220898493688111106,2020-01-25 02:37:38,RT @iPhilSomething: Livestream link to event here: https://t.co/H8MNfTY87t https://t.co/3ahuyQ6Jtp
1220898240465424384,2020-01-25 02:36:38,"RT @BNeidhardt: A pic of @BernieSanders at our Iowa City rally

(via @AriRabinHavt's phone) https://t.co/H06bbesKhh"
1220894674015211520,2020-01-25 02:22:28,RT @fshakir: Bernie calling in live https://t.co/wFuDjVl6Jc
1220892624686444544,2020-01-25 02:14:19,"Our slogan “Not Me, Us” has very much become reality since I’ve been in D.C. for Trump’s impeachment trial. You all… https://t.co/v1XVwIWtZS"
1220860745887506433,2020-01-25 00:07:38,"The climate crisis is an existential threat, putting at risk our very existence. I have proposed the most aggressiv… https://t.co/sjQlA2dzwj"
1220845233459601410,2020-01-24 23:06:00,Have you ever avoided taking an ambulance because you could not afford it?
1220838266389266434,2020-01-24 22:38:19,"I may be stuck in Washington for Trump's impeachment trial, but this is what ""Not Me, Us"" is all about.

There are… https://t.co/rfMk5iK2Ov"
1220831037405761537,2020-01-24 22:09:35,"We are in the middle of a climate emergency. Our Green New Deal, which will create 20 million good-paying jobs, is… https://t.co/gjbJIgQsKL"
1220820748123758592,2020-01-24 21:28:42,"Young people: this is your election.

If you turn out in record numbers we will not only beat Trump.

We will ensur… https://t.co/HYCqoMnyEp"
1220775540342345733,2020-01-24 18:29:04,"RT @thenation: ""Sanders is uniquely ready to beat Trump because he embodies the opposite of Trumpism."" https://t.co/oDFIg8ZQh2"
1220773001941209089,2020-01-24 18:18:59,"“I have seen him listen and act, and that makes me very confident about his consistency, confident in his values, c… https://t.co/k0amNUmdZO"
1220760231061413890,2020-01-24 17:28:14,Abortion is health care.
