ID,Timestamp,Content1167463455068164096,2019-08-30 15:45:52,"That's true. But if we continue to allow fracking and fossil fuel exports, the planet will never recover.

We don't… https://t.co/clzLedRzSB"
1167433945899835393,2019-08-30 13:48:37,If the environment were a bank it would have been saved already.
1167232133443796992,2019-08-30 00:26:41,We cannot accept a situation in which a tiny handful of Americans become extraordinarily wealthy by paying their wo… https://t.co/Mx4We1olVv
1167213975567659011,2019-08-29 23:14:32,We cannot take a middle ground approach when it comes to the climate crisis. We must pass a Green New Deal. Join ou… https://t.co/WS6ovDLIKT
1167210570015223809,2019-08-29 23:01:00,"This year alone:

-Anchorage, Alaska hit 90 degrees for the first time
-Greenland lost 250 billion tons of ice
-A c… https://t.co/gH0JGUUoIH"
1167193119445737472,2019-08-29 21:51:39,"If Donald Trump won't listen to the scientists when it comes to our climate crisis, maybe he will listen to the far… https://t.co/ZaZNgSJYlM"
1167182296987918344,2019-08-29 21:08:39,"We are facing a climate emergency, yet Trump is taking @fema disaster relief funds to pay for his racist immigratio… https://t.co/rlWLNXeLPr"
1167139883724496896,2019-08-29 18:20:07,"500,000 people in this country — at least — will go bankrupt this year from medical bills. That is a fact."
1167139100979322880,2019-08-29 18:17:00,"RT @billygendell: WaPo reported that 401 police forces have partnered with Amazon's Ring.

Reminder: @BernieSanders is the only candidate w…"
1167109352488099840,2019-08-29 16:18:48,“Your policy is the only policy that I have seen in my lifetime that matches up with the policy of what was the Poo… https://t.co/fElbToU7jn
1167094411114754048,2019-08-29 15:19:25,"Thousands of families in Iowa and nationwide are having their water contaminated by factory farms.

We have a solut… https://t.co/i2apWOuyl2"
1166903201209180160,2019-08-29 02:39:37,"In the richest country on Earth, our educators shouldn't have to worry whether they can make ends meet. Congratulat… https://t.co/fKfc7P9ig2"
1166851783777501184,2019-08-28 23:15:18,We must legalize marijuana nationwide and expunge past convictions.
1166841315755208704,2019-08-28 22:33:43,Congratulations to @SenGillibrand on her campaign to fight for working families across America and make health care… https://t.co/R4tGYTz2Ok
1166826784379346946,2019-08-28 21:35:58,"RT @WhipClyburn: August 28th marks both the anniversary of the murder of Emmett Till &amp; the March on Washington.

These anniversaries ought…"
1166819208820338688,2019-08-28 21:05:52,"To create fundamental change in America, we must bring millions of people into a movement for justice. I'm looking… https://t.co/b3TSUP65hu"
1166791652213739520,2019-08-28 19:16:22,"Congratulations, @CWAUnion! I was proud to stand on the picket line with @CWA3310 on Sunday. @ATT must bargain in g… https://t.co/tI1r9Hwqey"
1166788912087556096,2019-08-28 19:05:29,No one should be sitting in jail because they are poor. Cash bail is a disgrace and must be abolished.
1166776207725039618,2019-08-28 18:15:00,"☑️1 million people signed up to volunteer
☑️2 million calls to early states
☑️30 million text messages to early sta… https://t.co/JLucBlUSxZ"
1166758088637960192,2019-08-28 17:03:00,"Every kid in this country should be able to get a higher education if they desire one.

We must follow the lead of… https://t.co/Lx3E4DyOu1"
1166741746929283072,2019-08-28 15:58:04,It makes a lot more sense to me for cities and states to establish banks that invest in local communities instead o… https://t.co/Y0lHwqR5X3
1166735439388127232,2019-08-28 15:33:00,"Children receiving treatment for cancer are now being threatened with deportation.

The cruelty of this administrat… https://t.co/pJvfjhrwQQ"
1166727183295012864,2019-08-28 15:00:11,This is the guy that thinks windmills cause cancer. https://t.co/xnMto63qrc
1166718578009112576,2019-08-28 14:26:00,"Donald Trump betrayed workers.

We're going to reverse the damage he caused and together, we will create the strong… https://t.co/kptIRJfIDh"
1166709518325047297,2019-08-28 13:50:00,We cannot let corporate greed and political corruption destroy the Amazon rainforest that sustains our planet’s eco… https://t.co/RUziBP0dlf
1166709438792785920,2019-08-28 13:49:41,"RT @AdyBarkan: @BernieSanders Thank you Senator! 

Your leadership for Medicare-for-All has been invaluable. I'm excited to share our discu…"
1166701554176548866,2019-08-28 13:18:21,.@AdyBarkan is an inspiration to all of us in the fight for Medicare for All. Our corporate-run health care system… https://t.co/cT4lkaJ0ws
1166696444717404161,2019-08-28 12:58:03,Corporate greed killed thousands of Americans. The executives at Purdue Pharma who perpetrated these crimes should… https://t.co/4lGB0x2CgK
1166520855754657792,2019-08-28 01:20:19,Enough is enough. No child in America should go hungry. We need free universal school meals. https://t.co/lMe1CLZcru
1166520161257570304,2019-08-28 01:17:33,"RT @CaraKorte: Tonight on a @BernieSanders volunteer strategy call, the campaign says since April organizers have:

-Held 11k events nation…"
1166511463189508096,2019-08-28 00:43:00,There is a word to describe a health care system that leaves thousands to die each year because they can't afford h… https://t.co/BiKckwG62E
1166502282080509952,2019-08-28 00:06:31,"RT @AdyBarkan: The debates aren’t giving us the healthcare conversation we need.

So we asked the presidential candidates to talk to me abo…"
1166499383736766466,2019-08-27 23:55:00,"The prison phone industry is a monopoly worth more than $1 billion a year.

Corporations are getting rich denying p… https://t.co/5D4hDUeqnD"
1166485794330046464,2019-08-27 23:01:00,"Trump's racist immigration agenda must be stopped.

This country is not about locking up little children indefinite… https://t.co/S9BEQo3TXY"
1166475884758478854,2019-08-27 22:21:37,"RT @nowthisnews: 'Everything is at stake.'

Health care activist @AdyBarkan, who is dying of ALS, will challenge the top 2020 candidates in…"
1166473704890687488,2019-08-27 22:12:57,"If there is one thing I want young people to know, it is that they are incredibly powerful.

The corporate media or… https://t.co/90Gsme7jT2"
1166465409819774977,2019-08-27 21:40:00,"The patent for Insulin was sold for $1 so it would be available to all.

Insulin is now the 7th most expensive liqu… https://t.co/D1jmpyN63A"
1166462894244077569,2019-08-27 21:30:00,"We need your help to bring more working people into the political revolution! Tonight, join Bernie on a call to hel… https://t.co/9cbbeBlg0E"
1166427413414330369,2019-08-27 19:09:01,"Extremist politicians are waging a war on women.

They are going to lose.

Abortion is a constitutional right. https://t.co/1fpDLSnOYc"
1166421061103214593,2019-08-27 18:43:46,It is a disgrace that the United States locks up more people than any country on Earth. In my first term as preside… https://t.co/KLo4Fke1Tf
1166419818830094336,2019-08-27 18:38:50,"RT @MalcolmAkeem_: Did @BernieSanders just use me in a campaign video? 😁

They are the few and we are the many! When we stand up and demand…"
1166407529783529478,2019-08-27 17:50:00,"RT @People4Bernie: Our stories are one of our most powerful assets.

Billionaires can't buy our stories.

They can buy ads, but we're havin…"
1166407325751623684,2019-08-27 17:49:11,RT @briebriejoy: One of my favorite videos of this cycle to date! https://t.co/tvneADOaAU
1166387193704845312,2019-08-27 16:29:12,We are bringing millions of people into the political process on our way to defeating Donald Trump and transforming… https://t.co/IIdDtSOyYa
1166382801094107136,2019-08-27 16:11:44,"""This is Betsy DeVos, Jeff Bezos and all the other billionaires: 🌽

This is us: 🌽🌽🌽🌽🌽🌽🌽🌽🌽🌽🌽🌽🌽🌽🌽🌽🌽🌽🌽🌽🌽🌽🌽🌽🌽🌽🌽🌽🌽🌽🌽🌽🌽🌽🌽… https://t.co/Jv684OPBVE"
1166377535703269376,2019-08-27 15:50:49,RT @notaaroncraig: Wow! @BernieSanders outlines an ambitious plan to save local journalism and confront the harm greedy corporate media and…
1166374978490687489,2019-08-27 15:40:39,"RT @RispoliMike: In this piece for @CJR, @SenSanders shares his vision for strengthening journalism and cites @freepress throughout for our…"
1166363790398636033,2019-08-27 14:56:12,Thank you David for bringing more people into the political process! https://t.co/xGAcvJHkZl
1166363721222037504,2019-08-27 14:55:55,"RT @sunrisemvmt: ""We need a president who is willing to do anything it takes to pass a #GreenNewDeal.""

📰👇@VarshPrakash's op-ed on the lead…"
1166348234983387136,2019-08-27 13:54:23,"Corporate conglomerates and hedge fund vultures have decimated independent and local news.

We'll protect independe… https://t.co/MNrnGACFnE"
1166123406439223296,2019-08-26 23:01:00,"We say to Mitch McConnell, Donald Trump and the corporate elite: Your day has come and gone! https://t.co/XD1EZ8kYC7"
1166114720199389186,2019-08-26 22:26:29,"Our health care system is cruel and barbaric.

Your ability to get health care shouldn't be determined by the whims… https://t.co/DTn2Ffi4Xb"
1166099034160996352,2019-08-26 21:24:09,"We need to end voter suppression and make it easier for people to vote, not harder.

We need automatic voter regist… https://t.co/b5dzO3n57h"
1166090063266160642,2019-08-26 20:48:30,RT @FlyingWithSara: Yes. And let’s start by getting @senatemajldr to schedule a vote on S.27 - American Miners Act of 2019. We need to keep…
1166086315760410624,2019-08-26 20:33:37,"Today marks #WomensEqualityDay, 99 years since the ratification of the 19th Amendment. Our job now is to carry on t… https://t.co/C7rqJcuF3c"
1166069687588925440,2019-08-26 19:27:32,"RT @JaneKim: We support Bernie, not because we like his values, but because he stands for OURS. 

And there is no proposal more aligned wit…"
1166057635281592320,2019-08-26 18:39:39,"This election isn't about ""red states"" or ""blue states.""

In every state, there are working people who are desperat… https://t.co/QbFLHzf0Px"
1166056650458968064,2019-08-26 18:35:44,"RT @shaunking: @BernieSanders @JoeBiden New national poll shows that @BernieSanders not only has the most diverse support ethnically, but a…"
1166046398858420227,2019-08-26 17:55:00,"If companies want to shut down factories in America and move abroad, pay workers starvation wages and refuse to res… https://t.co/4Dw2TFxg53"
1166038424052207618,2019-08-26 17:23:18,RT @fshakir: hell yes. great courage and conviction right there. thank you @ueunion! https://t.co/6VtTHJT4DZ
1166035326080573441,2019-08-26 17:11:00,The trade union movement is the last line of defense against a billionaire class that won’t be satisfied until they have it all.
1166033848850890752,2019-08-26 17:05:08,RT @ueunion: Delegates to UE's 76th Convention unanimously endorse @BernieSanders for President #1u #ueunion #ue76th https://t.co/p6tkWdTzaW
1166024348509122560,2019-08-26 16:27:23,Donald Trump has reportedly directed his staff to prepare sweeping budget cuts to Medicare and Social Security for… https://t.co/wRymaIQ4hk
1166018681593311239,2019-08-26 16:04:51,RT @jamieson: .@ueunion becomes the first union to endorse Bernie Sanders for 2020: 'Bernie understands the need for workers to have a demo…
1166018220110876673,2019-08-26 16:03:01,"RT @danielmarans: .@ueunion, a 35,000-member left-wing union based in Pittsburgh, endorsed @BernieSanders for president today. It's Sanders…"
1166017070364057600,2019-08-26 15:58:27,I am humbled to receive the endorsement of my union brothers and sisters from @ueunion. Our fight is about the need… https://t.co/gstXdIe2T9
1166003455002939392,2019-08-26 15:04:21,Decade after decade @ueunion has been a leader in the struggle for economic justice and the right of all of our peo… https://t.co/i4wqiNmkLp
1165996708028997637,2019-08-26 14:37:33,"RT @sunrisemvmtlou: “Coal miners are not my enemy, workers in the fossil fuel industry are not my enemy, climate change is our enemy! For d…"
1165742788773842945,2019-08-25 21:48:33,"RT @CWAUnion: Senator @BernieSanders visited the picket line in Louisville, KY today to support striking CWA members at AT&amp;T Southeast! ✊
#…"
1165734301406830593,2019-08-25 21:14:50,"Senator McConnell has blocked gun safety legislation, he has blocked legislation to protect pensions, and he has bl… https://t.co/x454or3NP8"
1165730811980734469,2019-08-25 21:00:58,"Sen. Mitch McConnell receives huge campaign contributions from:
- Wall Street
- Health insurance companies
- Drug c… https://t.co/zMGNhbhZSs"
1165730247586852864,2019-08-25 20:58:43,Coal miners have seen their pensions cut and benefits slashed. Their communities have been destroyed while fossil f… https://t.co/trobz2Y0Or
1165729131486744577,2019-08-25 20:54:17,"We stand with the coal miners in Harlan County who aren’t receiving a paycheck.

I say to Senator McConnell: Do not… https://t.co/JBp9K7VJq0"
1165728039206051840,2019-08-25 20:49:57,Mitch McConnell: You need to explain to the people of Kentucky why you believe that we should do nothing to stop Ru… https://t.co/15DV28fXRY
1165726432556978178,2019-08-25 20:43:34,How many more Americans have to die in mass shootings before Senator McConnell has the guts to stand up to the NRA… https://t.co/fKFhFPPI1M
1165725025447632896,2019-08-25 20:37:58,"Over 500,000 workers in Kentucky make less than $15 an hour.

@senatemajldr: Why don't they deserve an average rais… https://t.co/Sa7s99iVnp"
1165723268504068096,2019-08-25 20:30:59,"I say to Sen. Mitch McConnell: stop worrying about your billionaire friends – they’re doing just fine. 

Start worr… https://t.co/FAl3tcvjKg"
1165719387749240832,2019-08-25 20:15:34,"I'm taking the fight directly to Republican Senate Leader Mitch McConnell with a rally in Louisville, Kentucky, to… https://t.co/1qOPT05SoS"
1165718172567257089,2019-08-25 20:10:44,"RT @AnnieGrayerCNN: The crowd in Louisville, Kentucky waiting for @BernieSanders to take the stage. https://t.co/sc1IKW7Q1B"
1165693841116147719,2019-08-25 18:34:03,Universal health care and tuition-free college aren’t radical. They already exist in other nations. Here’s what’s r… https://t.co/cQUUHCvEaR
1165679545070030853,2019-08-25 17:37:15,"I am proud to stand with the 20,000 @CWAUnion members who are on strike.

AT&amp;T made over $19 billion in profits las… https://t.co/XGwKD1YJzV"
1165602099142582274,2019-08-25 12:29:30,"RT @RoKhanna: .@BernieSanders has released a comprehensive criminal justice reform platform that includes ending

❌ Cash bail
❌ Death penal…"
1165430409376616448,2019-08-25 01:07:16,Tonight we say thank you to our grassroots donors. We're not going to win this election because we have a super PAC… https://t.co/VOaAoj336e
1165387054290735105,2019-08-24 22:15:00,Coal miners are not the enemy. Oil rig workers are not the enemy. Climate change is the enemy. When we pass a Green… https://t.co/xVHIkioSsx
1165380382122024962,2019-08-24 21:48:29,Tomorrow we are going to Mitch McConnell's backyard to say: the American people are sick and tired of the NRA writi… https://t.co/YQLYYsJdol
1165376466781179909,2019-08-24 21:32:55,This is a climate emergency. We need a Green New Deal. https://t.co/lfE26VQwUw
1165375074175725568,2019-08-24 21:27:23,RT @esmemurphy: .⁦@BernieSanders⁩ shoots hoops at Mn State Fair @wcco will update https://t.co/IpWq6rBYxN
1165356644852731904,2019-08-24 20:14:10,RT @BNeidhardt: At the Minnesota State Fair with a few friends and @BernieSanders. https://t.co/sFo2dHBeNm
1165356324244398082,2019-08-24 20:12:53,RT @AriRabinHavt: Crowd for @BernieSanders conversation with @MPRnews at the #minnesotastatefair https://t.co/zDLCFFXHTW
1165355596977192960,2019-08-24 20:10:00,"When it comes to the climate crisis, despair is not an option. https://t.co/mwIXyxiYCL"
1165345530685214720,2019-08-24 19:30:00,"""Medical debt"" and ""medical bankruptcy"" should not exist in the United States of America.

Getting sick is not a cr… https://t.co/8X2dEB7oEL"
1165323051489054720,2019-08-24 18:00:40,Nothing will fundamentally change unless we build a mass movement of people to win the White House and transform th… https://t.co/KOir5ByF9g
1165321623265775617,2019-08-24 17:55:00,"If there ever was a time to think big, not small, it is right now when we are fighting for the survival of the plan… https://t.co/RWG93pCT2b"
1165307785950781440,2019-08-24 17:00:01,"As a nation we must invest in education.

We need to raise teacher pay to at least $60,000 a year.

We need univers… https://t.co/IoJFB3TEr9"
1165297364455895045,2019-08-24 16:18:36,Tens of thousands of Americans die every year because they lack decent health insurance. There is no middle ground… https://t.co/Hbe11pjpOR
1165296753043750912,2019-08-24 16:16:10,RT @NVUnionLawyer: . @BernieSanders knows what is important to labor. We must stop IRAPs from ruining decades of excellence in apprenticesh…
1165296103706771456,2019-08-24 16:13:35,RT @TheIronworkers: RT @BernieSanders We appreciate the support. There's no place in the construction industry for IRAPs. The construction…
1165290203814256640,2019-08-24 15:50:09,"RT @iPhilSomething: Government is apathetic,  not us.   great talk with @BernieSanders aaaaand the crew. https://t.co/TLIxyK6qKd"
1165278129394520064,2019-08-24 15:02:10,"Playing it safe, according to the old rules is the most dangerous course we could take. It could cost us the electi… https://t.co/08LKw2ghUW"
1165064316959297536,2019-08-24 00:52:33,"The Democratic Party under President Roosevelt stood up to the economic royalists of its time.

This is the party t… https://t.co/4nVM9wWTRA"
1165047001152725009,2019-08-23 23:43:45,"In my view, we will only be successful if we rally an unprecedented, massive uprising of people to sweep Trump and… https://t.co/agW0FqBqaK"
1165046823821762563,2019-08-23 23:43:02,RT @AriRabinHavt: Totally packed town hall meeting on tuition free college and student loan forgiveness with @BernieSanders in San Francisc…
1165036942511280129,2019-08-23 23:03:47,"Our racist president emboldens bigots, xenophobes and white supremacists as domestic terrorists commit horrific act… https://t.co/E9LfWmNzZB"
1165029196554354690,2019-08-23 22:33:00,"Passing a #GreenNewDeal will not be easy. The fossil fuel industry will oppose us with everything they have.

But w… https://t.co/RGLQUyWuKA"
1165027683379466240,2019-08-23 22:26:59,The student debt crisis is holding back an entire generation. We're in California talking about our plan to make co… https://t.co/pUxlPmlQQ3
1165022308215468033,2019-08-23 22:05:38,"RT @DrDooleyMD: Today was tough.  

Two diabetics couldn’t afford their medications.

Had to tell someone they have Hep C &amp; prostate cancer…"
1165017972781568001,2019-08-23 21:48:24,"Yesterday I was in Paradise, California, a town nearly destroyed by a wildfire that killed 86 people. Climate chang… https://t.co/A44qsoQxlH"
1165001262565220353,2019-08-23 20:42:00,"By averting climate catastrophe we will save $70.4 trillion over 80 years.

A #GreenNewDeal is the only economic and the moral choice."
1164995547813613568,2019-08-23 20:19:17,"RT @sunrisemvmt: “What they want is very simple, they want an America that is good as is promised... We will pull and push until climate ju…"
1164988223044640769,2019-08-23 19:50:11,"Let me be blunt:

If we stick to a ""middle ground"" approach or half measures when it comes to the climate crisis, o… https://t.co/I8UyrfiL11"
1164984408870477825,2019-08-23 19:35:02,"RT @rebleber: Exclusive: Mother Jones &amp; The Weather Channel sat down with Bernie Sanders the day he released his Green New Deal. 

These ex…"
1164952321022988289,2019-08-23 17:27:31,RT @GoIUPAT: @GoIUPAT and millions of Americans who benefit from tried and true Registered Apprenticeships Thank @BernieSanders for his lea…
1164948358114492417,2019-08-23 17:11:46,"Nothing will fundamentally change unless we build a movement to take on the greed of the fossil fuel industry, Wall… https://t.co/bouJMKZK5b"
1164945426765799424,2019-08-23 17:00:08,"The IRAP proposal being pushed by Mick Mulvaney is a disaster. I stand with @TheIronworkers, @IUBAC, @GoIUPAT &amp; oth… https://t.co/iYRa3NwhF5"
1164925457357295617,2019-08-23 15:40:46,RT @foe_us: .@BernieSanders' ambitious climate plan matches the scope and scale of the climate crisis we are facing — and is the standard t…
1164919916589408256,2019-08-23 15:18:45,"Now is not the time for half measures or a middle ground.

We need fundamental changes in the way we do politics in… https://t.co/cu9V323y5A"
1164910109098725376,2019-08-23 14:39:47,"Some people say young people are apathetic.

Well, I have been hearing from young people all around the country. It… https://t.co/VAuNtYKeBS"
1164746233048719360,2019-08-23 03:48:36,"This campaign is not about middle ground solutions. 

This campaign is about transforming our country so that it fi… https://t.co/BUINrotceu"
1164728123822411777,2019-08-23 02:36:38,"The #GreenNewDeal will:
✅ Create 20 million jobs
✅ Avoid climate catastrophe
✅ Make fossil fuel companies pay their… https://t.co/d5xeKDqOYp"
1164708911120703488,2019-08-23 01:20:18,"We are the strongest campaign to defeat Donald Trump, and we'll do it by bringing millions of people into the polit… https://t.co/l4XwTSNhLW"
1164707577105670145,2019-08-23 01:15:00,"Why was it ""normal"" for taxpayers to bail out the bankers who wrecked our economy, but asking Wall Street to bail o… https://t.co/YdDbZ9OAFA"
1164693261367304192,2019-08-23 00:18:07,"A health care system that says, ""You and your family are going to lose your home because you got sick,"" is a system… https://t.co/qfRrRioMrb"
1164681155066699778,2019-08-22 23:30:00,"RT @MarkRuffalo: When I look in the faces of my children and the thousands of children I have come into contact with the Avengers, I can’t…"
1164681040771919872,2019-08-22 23:29:33,RT @largesteven: Loooonnngg line waiting in 90+ degree heat to get into Bernie Sanders rally at Sacramento’s Cesar Chavez Park. Sen. Sander…
1164679468826451968,2019-08-22 23:23:18,There is not justice when black women in America are making 61 cents on the dollar of what white men make. We have… https://t.co/vbG2a1czTQ
1164658917772865536,2019-08-22 22:01:38,"Mr. Trump, you are not going to have a second term. https://t.co/cgmV6tRqPm"
1164655554591150080,2019-08-22 21:48:17,"Coal miners are not our enemy.

Oil rig workers are not our enemy.

They are seeing their jobs slashed and communit… https://t.co/uWNkt7SZZK"
1164643929674997767,2019-08-22 21:02:05,RT @allinwithchris: TONIGHT: Tune in as @BernieSanders joins @chrislhayes at 8pm ET. #inners https://t.co/5672MqaGg8
1164640949630377984,2019-08-22 20:50:15,RT @KanielaIng: Don’t forget that these fires are being used to violently remove indigenous peoples from their land. Climate change is caus…
1164630289102069762,2019-08-22 20:07:53,Fossil fuel profits are not more important than the future of the planet. #GreenNewDeal
1164625335754862593,2019-08-22 19:48:12,RT @ava: Today is #BlackWomensEqualPayDay which highlights the hard fact that Black Women in America have to work 599 days to make what whi…
1164617470046437376,2019-08-22 19:16:57,"Unlike Trump we recognize climate change as the existential threat it is, not call it a hoax. We will create 20 mil… https://t.co/QIbtfIUaCZ"
1164613158050439178,2019-08-22 18:59:49,"RT @justicedems: ""Sanders plan distinguishes itself in how aggressively it targets the fossil fuel industry. Not only does it call for hiki…"
1164605869901963265,2019-08-22 18:30:51,RT @NaomiAKlein: Exactly. @SenSanders has massively moved the goal posts. This is what it means to treat the climate crisis like a true eme…
1164600749059452928,2019-08-22 18:10:30,"RT @belensisaw: @BernieSanders Specifics that will affect our gente in PR:

✅Ensure a hunger-free transition

✅Ensure FEMA protects communi…"
1164589093562572800,2019-08-22 17:24:11,Fossil fuel executives should be criminally prosecuted for the destruction they have knowingly caused. #GreenNewDeal
1164579049475325952,2019-08-22 16:44:16,"There is no such thing as ""clean coal."" There is no such thing as ""sustainably fracked"" natural gas.

We are going… https://t.co/57Mq2fteB0"
1164577467010560000,2019-08-22 16:37:59,"RT @GunnelsWarren: In 5 days, Bernie has released the 3 strongest plans to:

✅End mass incarceration &amp; enact real criminal justice
✅Expand,…"
1164570476980723712,2019-08-22 16:10:13,"RT @sunrisemvmt: Today @BernieSanders released his sweeping vision for a #GreenNewDeal.

It's the biggest, boldest, and most ambitious plan…"
1164570281085681667,2019-08-22 16:09:26,"RT @EricHolthaus: Here’s what people need to understand about @BernieSanders’ new climate plan:

This is it.

This is our one chance to bui…"
1164565165372825606,2019-08-22 15:49:06,"RT @fwaction: This morning @BernieSanders released a visionary plan for a #GreenNewDeal. The plan includes 100% clean energy by 2030, a ban…"
1164563968800804864,2019-08-22 15:44:21,The climate crisis is about the survival of this planet. We cannot go far enough or be too aggressive on this issue. #GreenNewDeal
