ID,Timestamp,Content1202772235725017089,2019-12-06 02:10:22,"RT @AOC: My family relied on food stamps (EBT) when my dad died at 48.

I was a student. If this happened then, we might’ve just starved.…"
1202769879280996352,2019-12-06 02:01:00,Thank you @JamesThompsonKS for speaking out and sharing your story. We're going to take on the health insurance gre… https://t.co/wiCaVpO5aR
1202763336204423170,2019-12-06 01:35:00,"The insurance industry lies that Medicare for All will mean ""long wait times.""

Read these replies.

There is an en… https://t.co/DVpTYK1DW5"
1202753603393318912,2019-12-06 00:56:19,"When we're in the White House we will represent the needs of working people and farmers, not big agribusiness and m… https://t.co/LMta3J1hIV"
1202750501575692289,2019-12-06 00:44:00,Wall Street’s greed has left millions unbanked or underbanked. We must establish basic banking services at post off… https://t.co/SAM9xYTTRi
1202736849913090048,2019-12-05 23:49:45,"In 1979 students paid $500 a year in today's dollars to attend Cal State University.

Today they pay $7,300.

We're… https://t.co/citF4yNpo3"
1202718134479839233,2019-12-05 22:35:23,RT @masspeaceaction: Massachusetts Peace Action proudly announces its endorsement of Bernie Sanders for President and vows to work hard for…
1202716906937028610,2019-12-05 22:30:30,RT @mikebonin: I am proud to endorse @BernieSanders for president and I am excited to be a part of an inspiring grassroots movement for pos…
1202697904965578752,2019-12-05 21:15:00,"Unlike Trump, we will not abandon fossil fuel workers.

Our Green New Deal guarantees:
-5 years of a fossil fuel wo… https://t.co/drLbeWVmzK"
1202682610620743680,2019-12-05 20:14:13,Have you ever postponed or skipped getting health care you needed due to the cost?
1202672233413517313,2019-12-05 19:32:59,"As you know, I don't spend my time traveling to ask big donors for money.

We won't have a super PAC.

And I'm not… https://t.co/IGl2oBr0vm"
1202661029693575168,2019-12-05 18:48:28,"Unlike Trump, I don't think climate change is a hoax.

I believe the scientists and will do everything I can to pas… https://t.co/ELiCmqESnI"
1202655726482731008,2019-12-05 18:27:24,"RT @IlhanMN: Lobbyists shouldn’t be controlling the conversation on healthcare. We really, really need to get corporate money out of politi…"
1202645068999512065,2019-12-05 17:45:03,"Californians want a Green New Deal, an end to homelessness, Medicare for All, and tuition- and debt-free higher edu… https://t.co/lu3yI2Hvvw"
1202638373929795584,2019-12-05 17:18:26,"While scientists tell us climate change is the great threat facing our planet, Trump thinks it is a ""hoax.""

Trump'… https://t.co/ILlJFMdR2T"
1202615518424907778,2019-12-05 15:47:37,"We are the climate campaign.

Our Green New Deal is the only proposal put forth by any candidate that is bold enoug… https://t.co/cpc0YeWj6W"
1202609339149754369,2019-12-05 15:23:04,The votes elected officials take should be based on the best interests of the American people—not the fear of retri… https://t.co/KJdOObAdWB
1202416026056564744,2019-12-05 02:34:55,"Thanks to grassroots groups like @OrgFlorida, Orlando voters chose people over corporations, defeated big money int… https://t.co/mdwZNZRhWh"
1202407743014895616,2019-12-05 02:02:00,"I’m proud we don’t have any billionaires supporting our campaign.

The time for the 0.1% calling the shots in our e… https://t.co/jryTtyvP9o"
1202395914913996800,2019-12-05 01:15:00,"Walmart’s CEO made 1,076 times more than the median Walmart worker last year.

The Walton family makes $70,000 a mi… https://t.co/fS3uKizwZp"
1202391950642556929,2019-12-05 00:59:15,It's simple: we need a Green New Deal because our kids and grandkids deserve a habitable planet.
1202387532207575040,2019-12-05 00:41:41,"We can only transform this country by building a movement of workers, affected communities, and local leaders. 

I'… https://t.co/wcs4AM9XXr"
1202370082250350592,2019-12-04 23:32:21,Abortion is a constitutional right – not a privilege for those who can afford it.
1202356905701720064,2019-12-04 22:39:59,We are going to win the Iowa caucus because we have the strongest grassroots organization and are bringing thousand… https://t.co/xKHzsxjhEz
1202342672461111297,2019-12-04 21:43:26,"Huge corporations like Amazon and Walmart don't want unions because unionized workers have higher wages, better ben… https://t.co/cSRN98hVzQ"
1202325061174214657,2019-12-04 20:33:27,"I'm immensely proud of the work that young people are doing to lead the world in fighting the climate crisis.

When… https://t.co/iyGdb28dcI"
1202304182876803072,2019-12-04 19:10:29,I'm tired of a political and economic system that lets the billionaire class rig the system in favor of themselves… https://t.co/41eaHc3hz7
1202285454160257026,2019-12-04 17:56:04,"What the establishment used to say about our ideas:

Raising the minimum wage to a living wage—too radical.
Guarant… https://t.co/LAvKRqsJvW"
1202270575491768321,2019-12-04 16:56:56,"I don't accept a system where billionaires get tax breaks while 1 in 6 teachers must work a second job.

We're goin… https://t.co/6H5tBxwrdF"
1202226051402874880,2019-12-04 14:00:01,"“I believe in him, and he is the people that I grew up with. He is those working class people and I know that he’s… https://t.co/Rvrm2Wk85j"
1202069422288068610,2019-12-04 03:37:38,Feel the bern. https://t.co/6pq7E9NLt6
1202046216953040897,2019-12-04 02:05:25,"Medicare for All means Medicare for ALL — not some, or a few, or most.

Health care is a human right.

Every other… https://t.co/Tm9Wjs42rl"
1202030341319536640,2019-12-04 01:02:20,We must set a national goal of ending the HIV epidemic in the U.S. by the year 2025 so that HIV is no longer a publ… https://t.co/aOcadVf3lC
1202014220696588290,2019-12-03 23:58:17,"Last week I met with students from @hgsuuaw, and this morning they began their strike. I stand with them in demandi… https://t.co/2c7LSwdvFT"
1201990848361172994,2019-12-03 22:25:24,I reject the idea that we can afford to pay for endless wars in the Middle East but not health care for all of our children.
1201983953554550784,2019-12-03 21:58:00,".@RoKhanna knows from experience that the struggle for immigration justice is a civil rights struggle.

As presiden… https://t.co/0rhuMfOBui"
1201968538895958018,2019-12-03 20:56:45,"This is what happened when people in the U.K. were asked how much health care costs in the U.S.

Remember that our… https://t.co/1ZZauNpNoE"
1201960201005477889,2019-12-03 20:23:37,"RT @IAStudentAction: We’re thrilled to follow @CCIAction &amp; endorse @BernieSanders. We trust him to fight for students, #CollegeForAll (incl…"
1201938255597445120,2019-12-03 18:56:25,Thank you @KamalaHarris for running a spirited and issue-oriented campaign. I look forward to working with you to d… https://t.co/Z8wk28SW7Y
1201865105543237632,2019-12-03 14:05:45,I very much hope that Major League Baseball and Minor League Baseball can resolve their differences and maintain pr… https://t.co/qXGFshsCv4
1201666434734198784,2019-12-03 00:56:18,"20 million people are being displaced from their homes every year due to climate-fueled disasters.

20 million.

Ha… https://t.co/Rqz9Yp4qEc"
1201647404015128576,2019-12-02 23:40:41,The health insurance lobbyists who profit off of our broken health care system are scared because the American peop… https://t.co/GtJJiWeYre
1201641522493566976,2019-12-02 23:17:19,"RT @CCIAction: From standing with us on strike lines with fast food workers to touring rural Iowa plagued by factory farms, Bernie has help…"
1201637132932190208,2019-12-02 22:59:52,"I stand in solidarity with the student workers at Harvard. All workers deserve respect, dignity, a living wage, acc… https://t.co/rA9XNa783p"
1201620564714180613,2019-12-02 21:54:02,Greed and out-of-control consolidation in our corporate health care system means higher profits for executives and… https://t.co/smTGsYbkbb
1201608377601802240,2019-12-02 21:05:36,"Prisons should not be for profit.

Health insurance should not be for profit.

We need to move in the direction of… https://t.co/gd918tlmTv"
1201564745293279232,2019-12-02 18:12:13,"""Amazon is a trillion-dollar company. Working conditions can be much better than they are right now."" #CyberMonday https://t.co/9VIweXlnhO"
1201562644995551241,2019-12-02 18:03:53,RT @CCIAction: That's why Iowa CCI Action is endorsing @BernieSanders. We’re standing with Bernie because Bernie stands with us. https://t.…
1201545259613863938,2019-12-02 16:54:48,"RT @BNeidhardt: Iowa's largest progressive organization has endorsed @BernieSanders.

Let's get to work and win this thing, Iowa CCI. https…"
1201544190724849670,2019-12-02 16:50:33,"I'm honored to receive the endorsement of @CCIAction. Together, we're going to win the Iowa caucus and defeat Trump… https://t.co/5TgDTFoN0m"
1201516422964355074,2019-12-02 15:00:12,"If you had a couple billion dollars, you could announce your candidacy for president and be taken seriously, even i… https://t.co/FcZJg7dNEY"
1201289373607575554,2019-12-01 23:58:00,We have all the tools we need to end AIDS deaths and HIV transmissions. We just need the political will to do it. W… https://t.co/NY99cu9uJw
1201279525033795584,2019-12-01 23:18:52,"RT @NationalNurses: Nurses are ready to fight for a movement builder like @BernieSanders — someone who understands: it's not about ""me,"" it…"
1201264132827291648,2019-12-01 22:17:42,We have made great progress but too many people living with HIV and AIDS are suffering because they can’t afford th… https://t.co/RyN1lxPHSX
1201259760391270401,2019-12-01 22:00:19,"RT @AriRabinHavt: ✅ Chicken
✅ Waffles
✅ @BernieSanders Eat and Greet

Great event. Thanks for coming out Columbia, SC #Bernie2020 #FeelTheB…"
1201250536122699780,2019-12-01 21:23:40,"Last year South Carolina spent:

$21,756 per prison inmate
$11,552 per student

It makes no rational sense to inves… https://t.co/3OYV06rD6b"
1201247800660348929,2019-12-01 21:12:48,"No billionaires, super PACs or corporate lobbyists are supporting us, and we wouldn’t have it any other way. We are… https://t.co/tocsJWmX6A"
1201244989348601862,2019-12-01 21:01:38,"RT @AbdulElSayed: Running with the courage of your convictions is THE ONLY way to run—and win. 

@BernieSanders has been doing it since the…"
1201225560971722754,2019-12-01 19:44:26,"Coal miners are not the enemy.

Oil rig workers are not the enemy.

Climate change is the enemy.

As we transition… https://t.co/vVJmIz1t5H"
1201216747723993096,2019-12-01 19:09:24,"RT @IlhanMN: Reminder: 136 days ago, the House voted to raise the minimum wage to $15.

That bill would’ve increased pay for up to 27 milli…"
1201207841903796229,2019-12-01 18:34:01,"The top .0025% saw their wealth double in the last decade and their tax rate fall.

We have the money to provide ba… https://t.co/c6AXdtlIOX"
1201198234280046594,2019-12-01 17:55:50,RT @ninaturner: 64 years ago Sister Rosa Parks showed us there is no progress w/o struggle. We owe it to her legacy to never become cynical…
1201173719185547264,2019-12-01 16:18:26,"RT @MegKinnardAP: @BernieSanders @ninaturner ""When we read from the scriptures, the calling for the moment now is for nothing less than jus…"
1200935321480912897,2019-12-01 00:31:07,"We're up against incredibly powerful special interests who will spend outrageous amounts of money to defeat us.

We… https://t.co/gePiIAQywJ"
1200905238129135616,2019-11-30 22:31:35,Our Green New Deal is the most aggressive and comprehensive plan to deal with the climate crisis introduced by any… https://t.co/jvjSOEkhyJ
1200838150769270789,2019-11-30 18:05:00,"For too long, huge corporate monopolies have rigged our economy.

Their goal: maximize profits at the expense of sm… https://t.co/DV4XdR04gx"
1200820754801135617,2019-11-30 16:55:52,Billionaires should not be able to buy elections.
1200811316119769091,2019-11-30 16:18:22,"It takes incredible courage to speak up against your employer, especially when they are the 2nd wealthiest man in t… https://t.co/pzaclxAsjl"
1200784943036669955,2019-11-30 14:33:34,"This holiday season take a moment to think of the postal workers who are working incredibly hard.

Trump wants to p… https://t.co/dfEcqXcj9T"
1200529926308474880,2019-11-29 21:40:13,"Amazon is one of the largest corporations in the world, but it paid $0 in federal income taxes.

It's owned by Jeff… https://t.co/Q5TP44l728"
1200489002777886728,2019-11-29 18:57:36,"The problems we face as a nation may seem insurmountable.

But if there ever was a time when despair was not an opt… https://t.co/8T2mSv54Ow"
1200466582293667842,2019-11-29 17:28:31,"RT @NNUBonnie: This endorsement is about more than just advancing one leader; it’s about advancing a grassroots movement for change.

It’s…"
1200125500942962690,2019-11-28 18:53:11,"RT @mcbyrne: My family lives on pensions and social security. Like Bernie, #IFightForThem to have their retirement with dignity. Protecting…"
1200123650944446464,2019-11-28 18:45:50,"RT @skenigsberg: This Thanksgiving, I’m thankful for the young people who are fighting for themselves and future generations to live in a c…"
1200123182130302976,2019-11-28 18:43:58,RT @lsarsour: I grew up in Brooklyn and went to public school my whole life. It was devastating for so many of my friends when it was time…
1200122182820433924,2019-11-28 18:40:00,"This Thanksgiving 500,000 Americans are homeless. I fight for them. 

45 million are dealing with student debt and… https://t.co/JMIQ9ojAfu"
1200120966900277249,2019-11-28 18:35:10,"RT @nashwahakh: From being ‘randomly selected’ at airports, to having our mosques vandalized &amp; our homes, cars, phones surveilled, my Musli…"
1200119513544642561,2019-11-28 18:29:23,"RT @belensisaw: My mother did multiple jobs as I was growing up, in the kitchen of a restaurant and cleaning homes. Today domestic and agri…"
1200118970281533442,2019-11-28 18:27:14,"RT @the_vello: I fight for the Americans who have never had a voice in the political process

The families struggling to put food on the ta…"
1200118859291860995,2019-11-28 18:26:47,"RT @hn_zink: My mom’s terminally ill &amp; shows the world that a disability shan’t stop anyone, my dad has student debt out his ears &amp; medical…"
1200116393334706177,2019-11-28 18:16:59,"RT @LauraeMunoz: Over 5 years ago my dad passed away in a workplace accident. As immigrant workers, my parents witnessed shameful condition…"
1200115625315774465,2019-11-28 18:13:56,"RT @OrganizerJess36: My Dad, Mel, recently passed. I worry every day for my mom, Cookie, who relied on his income. I support @BernieSanders…"
1200114842880921601,2019-11-28 18:10:50,RT @tomaskenn: Today I am thinking of immigrant families in this country that live in fear of deportation. People like my dad who couldn’t…
1200114433999200257,2019-11-28 18:09:12,"RT @OliverHidWoh: My dad came to the US as a teenager, fleeing the dictatorship in Chile. He met my mom and they raised our family in Iowa.…"
1200114074136256513,2019-11-28 18:07:46,RT @StephCW_: My parents came to this country in search of a better life and sacrificed everything so my brother and I could follow our dre…
1200113432781053953,2019-11-28 18:05:14,RT @kateyeager_: My parents are public school teachers who have 57 years of combined teaching experience. Though they love their jobs &amp; mak…
1200113088479059969,2019-11-28 18:03:51,"RT @tylerevansokay: My mama has worked as a nurse for decades. Because of our expensive for-profit health care system, she’s had to delay r…"
1200111864832647168,2019-11-28 17:59:00,"My parents didn't have easy lives. My father, a paint salesman, never made much money. My mother didn't live long e… https://t.co/LysNbZPE1z"
1200066088639385600,2019-11-28 14:57:06,Wishing a safe and happy Thanksgiving to you and your loved ones. We are grateful for the millions of people who ar… https://t.co/Ep5kPUAbvE
1199848148224684033,2019-11-28 00:31:05,"The Virginia AFL-CIO and Lee Carter are right.

If we're going to expand the middle class and end corporate greed,… https://t.co/sbU0zI13Mz"
1199821284194050049,2019-11-27 22:44:20,Thank you to the youth leaders of @CPDAction network and @4EdJustice for an important and emotional discussion on h… https://t.co/pjdLsbyoUw
1199807184990822400,2019-11-27 21:48:18,"At her concerts @ArianaGrande has registered 20,000 people to vote through https://t.co/n3hjn75wFN. She is doing ex… https://t.co/XBe8TQvEqS"
1199773563483492352,2019-11-27 19:34:42,RT @ArianaGrande: my favorite duo. love u @jimmyfallon. thanks for your kindness and all that u do @BernieSanders. https://t.co/jKKzvifl5s
1199751922196058112,2019-11-27 18:08:43,We will put a moratorium on deportations and break up ICE so that no family has to live in terror of losing their l… https://t.co/lxB5MzN6yJ
1199735310554468352,2019-11-27 17:02:42,"When people stand together and fight, we win. Thank you to the @womensmarch for inspiring people to get involved in… https://t.co/ICTw3DIhg8"
1199727578925408257,2019-11-27 16:31:59,"I won my race for mayor by 10 votes.

We had to take on the entire Democratic establishment.

But after a few years… https://t.co/OkCP3Dj2ZS"
1199718909068423168,2019-11-27 15:57:32,"This is appalling and cruel.

When we are in the White House we will not rest until all children separated from the… https://t.co/CemtURRJ1K"
1199714872747003907,2019-11-27 15:41:29,RT @FallonTonight: Senator @BernieSanders on global climate change #FallonTonight https://t.co/JvLJ5JwSXz
1199709539270045696,2019-11-27 15:20:18,"RT @AriRabinHavt: During rehearsal @BernieSanders sinking shots, @jimmyfallon going for the layup https://t.co/WbeejY2xDC"
1199537784278716416,2019-11-27 03:57:48,"Coming up soon: catch me slow jam the news on @FallonTonight at 11:35 ET. Thanks for having me on!

Photos: Andrew… https://t.co/ENOyhif7no"
1199537492401295360,2019-11-27 03:56:39,RT @FallonTonight: 1 hour until Jimmy &amp; Senator @BernieSanders Slow Jam the News on #FallonTonight! https://t.co/JHF6mRocJq
1199504866273644545,2019-11-27 01:47:00,"We have got to end the private prison and detention racket in America, and reverse the racist criminalization of im… https://t.co/EHo6JLg6Ax"
1199481266418139137,2019-11-27 00:13:13,"Google is too big, too powerful, and its anti-worker actions will end when we are in the White House. We are going… https://t.co/OdJWB9fMEm"
1199469189871722496,2019-11-26 23:25:14,Campaign Manager @fshakir is live from New York with an update for our grassroots supporters on our path to victory… https://t.co/7s83TncGx3
1199455289205936128,2019-11-26 22:30:00,"""The platform and the policies [Bernie] has put forward will do wonders for Black people, Black women, trans people… https://t.co/UUA6QhAFNq"
1199446480551067655,2019-11-26 21:55:00,"If you're worried about getting into an argument with your family this holiday, here's my advice for you.

Listen t… https://t.co/7D2Bz0itKc"
1199445384717852672,2019-11-26 21:50:38,"RT @FallonTonight: Tonight on the show: Senator @BernieSanders is here! Plus, Katherine Langford and @garyvee! #FallonTonight https://t.co/…"
1199438514863165441,2019-11-26 21:23:21,RT @RobertJPeters: Honored to be in this fight with @BernieSanders. https://t.co/fLuJaSjNqS
1199437654582079490,2019-11-26 21:19:55,"""Bernie Sanders understands that in a time of crisis that being bold is the most realistic option."" –Illinois State… https://t.co/tW8uRzg7Aa"
1199429676873265153,2019-11-26 20:48:13,"RT @ninaturner: The ruling class doesn’t stand a chance against #BigUs. When you are willing to fight for someone you don’t know, there is…"
1199424759169191936,2019-11-26 20:28:41,We are going to ensure that no one pays more than $200 a year for the prescription drugs they need.
1199424625618440194,2019-11-26 20:28:09,"RT @32BJSEIU: Thank you Sen ⁦@BernieSanders⁩ for joining @ChipotleTweets workers, ⁦@AmericanAir⁩ #Eulen subcontracted cleaners &amp; NYC office…"
1199402234485891074,2019-11-26 18:59:11,"This is an emergency. We can not afford half measures.

I am proud to have introduced the only plan that will addre… https://t.co/UwgobE19tE"
1199386599303323648,2019-11-26 17:57:03,"Thank you, @UNITEHERE, for your courage. @AmericanAir made $1.4 billion in profits last year but refuses to pay wor… https://t.co/8XuJSh9qav"
1199361307096559616,2019-11-26 16:16:33,"RT @AbshirDSM: You’ve heard of Big Oil, Big Pharma, and Big Money. 

None of them stand a chance against #BigUs 
 https://t.co/HLAbEBJTtS"
1199360591703543808,2019-11-26 16:13:42,"RT @BNeidhardt: Here is the fifth @BernieSanders ad running in Iowa. 

Our message: When Bernie is in the White House, he is going to fight…"
1199356646155259905,2019-11-26 15:58:02,"RT @mistyrebik: Big us. I'm good with that. 

#Bernie2020 #IACaucus https://t.co/RwPbpyaWev"
1199356512898048001,2019-11-26 15:57:30,RT @sunrisemvmt: Big Us &gt; Big Oil https://t.co/2yxY19wZ1i
1199346470387740674,2019-11-26 15:17:35,"""He’s not there for Wall Street. He’s not there for Hollywood. He’s not there for big oil, or big pharma or big any… https://t.co/6Fp2H5OYDX"
1199335763181223936,2019-11-26 14:35:03,"RT @IlhanMN: .@BernieSanders’ people-powered movement inspired me to run for Congress to take on corruption and fight for progress.

From #…"
1199123854611730432,2019-11-26 00:33:00,We are going to live up the values Dr. King espoused and end the hatred coming from the Trump administration. https://t.co/Dit5a3iz47
1199109451980120064,2019-11-25 23:35:46,"From Little Rock to Houston, our campaign stands with the educators, parents and communities fighting against the d… https://t.co/huqW7fjncP"
1199095552270467073,2019-11-25 22:40:32,"It was the trade union movement that built the middle class in this country, and it is the trade union movement tha… https://t.co/grgvfj5oNp"
1199076297953046528,2019-11-25 21:24:01,Trump’s plan is to divide us up because that's the only way he can win. We are going to do the opposite. Our campai… https://t.co/ylRGe1k6rL
1199044833853235201,2019-11-25 19:19:00,"Download the BERN app today and share your #MyBernieStory.

Apple Store: https://t.co/mbCA72VaoJ
Google Play: https://t.co/zhSr26YwQ4"
1199044766912188416,2019-11-25 19:18:44,"My experiences growing up in a working class family shaped my values as a candidate for president.

All of us have… https://t.co/fHWdxKElrF"
1199028178989330432,2019-11-25 18:12:49,@MLB Download the letter here: https://t.co/Jb7uxMGbpF
1199027511604260870,2019-11-25 18:10:10,".@MLB is proposing to cut 42 Minor League Baseball clubs.

This has nothing to do with what's good for baseball and… https://t.co/4fNveoqM5u"
1199014467763232777,2019-11-25 17:18:20,The right to form a union is a constitutional right. Any corporation that engages in union busting or job outsourci… https://t.co/16SD4JgHXb
1199005304886845440,2019-11-25 16:41:55,"The wealth of the billionaire class is almost incomprehensible.

The Waltons get $70,000 richer every minute.

Jeff… https://t.co/XWwwIbayea"
1198753916994883584,2019-11-25 00:03:00,If we could put people on the moon 50 years ago we sure as hell can make automatic voter registration possible nationwide.
1198751047939960832,2019-11-24 23:51:36,RT @AOC: Dance Dance Revolution! 🌺🗳 https://t.co/LImdKevrPO
1198734539176206339,2019-11-24 22:46:00,.@IronStache and @justinlong mustache you a question: Can you go to https://t.co/bNNVHcixty to join a Bernie 2020 v… https://t.co/sMMhzSdH7K
1198727973257367553,2019-11-24 22:19:54,Trump lied when he said he’d stand up to corporate greed and help working people. We’re going to do what he failed… https://t.co/89SWIk8Lq0
1198692259857944577,2019-11-24 19:58:00,"People went to jail, people were beaten and people died fighting for the right to form a union.

Our job now is not… https://t.co/77HxEBtMvD"
1198677861902815233,2019-11-24 19:00:47,"We do not believe that billionaires have the right to buy elections. 

That is why multi-billionaires like Michael… https://t.co/MOPID3r9bJ"
1198670495094165505,2019-11-24 18:31:30,Nothing scares the billionaire class more than a strong union movement. We will fight for a union for every worker.… https://t.co/5aZJrTV94l
1198661555908468737,2019-11-24 17:55:59,"Democracy must mean democracy in the workplace as well.

When I am president, when 50% of workers in a unit sign a… https://t.co/eiQ4ygLwAy"
1198660677528936449,2019-11-24 17:52:30,"RT @AnnieGrayerCNN: After his remarks at the labor solidarity dinner in Manchester, NH, @BernieSanders danced. https://t.co/yhTfonsSHD"
1198630768609841153,2019-11-24 15:53:39,"As president, I will shut down the Keystone Pipeline that should never have been built in the first place. https://t.co/7oL1RBGiwQ"
1198411024233316352,2019-11-24 01:20:28,Having the time of my life https://t.co/Jl2z5zX39T
1198391913210142720,2019-11-24 00:04:31,"If you're curious as to why massive, greedy corporations like Amazon and Walmart try to bust unions, remember that… https://t.co/GKcJzuBqFJ"
1198386600884879361,2019-11-23 23:43:25,I’m proud to have the boldest pro-union platform in the history of American politics. When we are in the White Hous… https://t.co/A2tB8xTCy7
